{
  "version": 1,
  "repo": {"name": "fixtures", "loc": 318, "files": 7},
  "budget": {"target": 4096, "rendered": 635, "detail": "full"},
  "files": [
    {"path": "c.c", "lang": "c", "rank": 1, "score": 0.024562, "imported_by": 0, "one_line": false, "omitted": 0, "symbols": [{"kind": "class", "name": "Point", "sig": "struct Point", "line": 7, "visibility": "public"}, {"kind": "field", "name": "x", "sig": "int x", "line": 8, "visibility": "public"}, {"kind": "field", "name": "y", "sig": "int y", "line": 9, "visibility": "public"}, {"kind": "enum", "name": "Color", "sig": "enum Color", "line": 12, "visibility": "public"}, {"kind": "type", "name": "PointAlias", "sig": "typedef struct Point PointAlias", "line": 18, "visibility": "public"}, {"kind": "function", "name": "reset", "sig": "void reset(void)", "line": 21, "visibility": "public"}, {"kind": "function", "name": "add", "sig": "int add(int a, int b)", "line": 23, "visibility": "public"}, {"kind": "function", "name": "helper", "sig": "static int helper(int x)", "line": 27, "visibility": "private"}], "imports": [], "used_by": []},
    {"path": "cpp.cpp", "lang": "cpp", "rank": 2, "score": 0.024562, "imported_by": 0, "one_line": false, "omitted": 0, "symbols": [{"kind": "module", "name": "service", "sig": "namespace service", "line": 7, "visibility": "public"}, {"kind": "class", "name": "Service", "sig": "class Service", "line": 9, "visibility": "public"}, {"kind": "method", "name": "Service", "sig": "Service(int count)", "line": 11, "visibility": "public"}, {"kind": "method", "name": "total", "sig": "int total() const", "line": 12, "visibility": "public"}, {"kind": "method", "name": "adjust", "sig": "int adjust(int delta)", "line": 15, "visibility": "private"}, {"kind": "method", "name": "helper", "sig": "int helper(int x)", "line": 18, "visibility": "private"}, {"kind": "field", "name": "count_", "sig": "int count_", "line": 19, "visibility": "private"}, {"kind": "class", "name": "Point", "sig": "struct Point", "line": 22, "visibility": "public"}, {"kind": "field", "name": "x", "sig": "int x", "line": 23, "visibility": "public"}, {"kind": "field", "name": "y", "sig": "int y", "line": 24, "visibility": "public"}, {"kind": "enum", "name": "Level", "sig": "enum class Level", "line": 27, "visibility": "public"}, {"kind": "type", "name": "Id", "sig": "using Id = int", "line": 32, "visibility": "public"}, {"kind": "function", "name": "add", "sig": "int add(int a, int b)", "line": 34, "visibility": "public"}], "imports": [], "used_by": []},
    {"path": "go.go", "lang": "go", "rank": 3, "score": 0.015186, "imported_by": 0, "one_line": false, "omitted": 0, "symbols": [{"kind": "constant", "name": "APIVersion", "sig": "const APIVersion = \"1.0\"", "line": 11, "visibility": "public"}, {"kind": "constant", "name": "internalFlag", "sig": "const internalFlag = false", "line": 13, "visibility": "private"}, {"kind": "function", "name": "TopLevel", "sig": "func TopLevel(x int) int", "line": 16, "visibility": "public"}, {"kind": "function", "name": "helper", "sig": "func helper(x int) int", "line": 20, "visibility": "private"}, {"kind": "class", "name": "Service", "sig": "type Service struct", "line": 25, "visibility": "public"}, {"kind": "field", "name": "Name", "sig": "Name  string", "line": 26, "visibility": "public"}, {"kind": "field", "name": "count", "sig": "count int", "line": 27, "visibility": "private"}, {"kind": "interface", "name": "Runner", "sig": "type Runner interface", "line": 31, "visibility": "public"}, {"kind": "method", "name": "Run", "sig": "func (s *Service) Run() error", "line": 36, "visibility": "public"}, {"kind": "method", "name": "reset", "sig": "func (s *Service) reset()", "line": 41, "visibility": "private"}], "imports": [], "used_by": []},
    {"path": "java.java", "lang": "java", "rank": 4, "score": 0.015186, "imported_by": 0, "one_line": false, "omitted": 0, "symbols": [{"kind": "class", "name": "Service", "sig": "public class Service", "line": 9, "visibility": "public"}, {"kind": "field", "name": "API_VERSION", "sig": "public static final String API_VERSION = \"1.0\"", "line": 10, "visibility": "public"}, {"kind": "field", "name": "count", "sig": "private int count", "line": 11, "visibility": "private"}, {"kind": "method", "name": "Service", "sig": "public Service(int count)", "line": 13, "visibility": "public"}, {"kind": "method", "name": "total", "sig": "public int total()", "line": 17, "visibility": "public"}, {"kind": "method", "name": "helper", "sig": "private int helper(int x)", "line": 21, "visibility": "private"}, {"kind": "interface", "name": "Runner", "sig": "interface Runner", "line": 26, "visibility": "public"}, {"kind": "method", "name": "run", "sig": "void run()", "line": 27, "visibility": "public"}, {"kind": "enum", "name": "Level", "sig": "enum Level", "line": 30, "visibility": "public"}], "imports": [], "used_by": []},
    {"path": "python.py", "lang": "python", "rank": 5, "score": 0.015186, "imported_by": 0, "one_line": false, "omitted": 0, "symbols": [{"kind": "constant", "name": "API_VERSION", "sig": "API_VERSION = \"1.0\"", "line": 6, "visibility": "public"}, {"kind": "function", "name": "top_level", "sig": "def top_level(x: int) -> int", "line": 9, "visibility": "public"}, {"kind": "function", "name": "fetch", "sig": "async def fetch(url: str) -> Optional[str]", "line": 13, "visibility": "public"}, {"kind": "function", "name": "helper", "sig": "def helper(x: int) -> int", "line": 17, "visibility": "public"}, {"kind": "class", "name": "Service", "sig": "class Service", "line": 21, "visibility": "public"}, {"kind": "method", "name": "name", "sig": "def name(self) -> str", "line": 25, "visibility": "public"}, {"kind": "method", "name": "run", "sig": "def run(self) -> None", "line": 28, "visibility": "public"}, {"kind": "method", "name": "helper_method", "sig": "def helper_method() -> None", "line": 32, "visibility": "public"}, {"kind": "class", "name": "Mark", "sig": "class Mark", "line": 36, "visibility": "public"}, {"kind": "field", "name": "name", "sig": "name: str", "line": 39, "visibility": "public"}, {"kind": "field", "name": "args", "sig": "args: tuple", "line": 40, "visibility": "public"}, {"kind": "field", "name": "description", "sig": "description: str | None = None", "line": 41, "visibility": "public"}, {"kind": "field", "name": "_internal", "sig": "_internal: int = 0", "line": 42, "visibility": "private"}, {"kind": "function", "name": "decorating", "sig": "def decorating(fn)", "line": 45, "visibility": "public"}, {"kind": "function", "name": "decorated", "sig": "def decorated() -> None", "line": 50, "visibility": "public"}, {"kind": "class", "name": "DecoratedService", "sig": "class DecoratedService", "line": 55, "visibility": "public"}], "imports": [], "used_by": []},
    {"path": "rust.rs", "lang": "rust", "rank": 6, "score": 0.015186, "imported_by": 0, "one_line": false, "omitted": 0, "symbols": [{"kind": "constant", "name": "API_VERSION", "sig": "pub const API_VERSION: &str = \"1.0\"", "line": 7, "visibility": "public"}, {"kind": "constant", "name": "GLOBAL_FLAG", "sig": "pub static GLOBAL_FLAG: bool = false", "line": 8, "visibility": "public"}, {"kind": "function", "name": "top_level", "sig": "pub fn top_level(x: u32) -> u32", "line": 10, "visibility": "public"}, {"kind": "function", "name": "helper", "sig": "fn helper(x: u32) -> u32", "line": 14, "visibility": "private"}, {"kind": "class", "name": "Service", "sig": "pub struct Service", "line": 18, "visibility": "public"}, {"kind": "field", "name": "names", "sig": "names: BTreeMap<String, u32>,", "line": 19, "visibility": "private"}, {"kind": "enum", "name": "Level", "sig": "pub enum Level", "line": 22, "visibility": "public"}, {"kind": "interface", "name": "Runner", "sig": "pub trait Runner", "line": 27, "visibility": "public"}, {"kind": "method", "name": "run", "sig": "fn run(&self)", "line": 28, "visibility": "private"}, {"kind": "method", "name": "ready", "sig": "fn ready(&self) -> bool", "line": 30, "visibility": "private"}, {"kind": "method", "name": "new", "sig": "pub fn new() -> Self", "line": 36, "visibility": "public"}, {"kind": "method", "name": "run", "sig": "fn run(&self)", "line": 44, "visibility": "private"}, {"kind": "module", "name": "nested", "sig": "pub mod nested", "line": 50, "visibility": "public"}, {"kind": "type", "name": "Alias", "sig": "pub type Alias = u64", "line": 51, "visibility": "public"}, {"kind": "function", "name": "shout", "sig": "macro_rules! shout", "line": 54, "visibility": "private"}], "imports": [], "used_by": []},